CPU: ID 0x306f2, Processor Type 0x0, Family 0x6, Model 0x3f, Stepping 0x2
Northbridge: 8086:2f00 (unknown)
Southbridge: 8086:8c50 (B85)

============= GPIOS =============

GPIOBASE = 0x0500 (IO)

gpiobase+0x0000: 0x9908f83d (GPIO_USE_SEL)
gpiobase+0x0004: 0x06b766ff (GP_IO_SEL)
gpiobase+0x0008: 0x00000000 (RESERVED)
gpiobase+0x000c: 0x20a96ffd (GP_LVL)
gpiobase+0x0010: 0x00000000 (RESERVED)
gpiobase+0x0014: 0x00000000 (RESERVED)
gpiobase+0x0018: 0x00040000 (GPO_BLINK)
gpiobase+0x001c: 0x00000000 (GP_SER_BLINK)
gpiobase+0x0020: 0x00080000 (GP_SB_CMDSTS)
gpiobase+0x0024: 0x00000000 (GP_SB_DATA)
gpiobase+0x0028: 0x0000     (GPI_NMI_EN)
gpiobase+0x002a: 0x0000     (GPI_NMI_STS)
gpiobase+0x002c: 0x00000000 (GPI_INV)
gpiobase+0x0030: 0x02fc5019 (GPIO_USE_SEL2)
gpiobase+0x0034: 0x1d82ff20 (GP_IO_SEL2)
gpiobase+0x0038: 0xfc0b2fd6 (GP_LVL2)
gpiobase+0x003c: 0x00000000 (RESERVED)
gpiobase+0x0040: 0x00000300 (GPIO_USE_SEL3)
gpiobase+0x0044: 0x00000ff0 (GP_IO_SEL3)
gpiobase+0x0048: 0x00000dff (GP_LVL3)
gpiobase+0x004c: 0x00000000 (RESERVED)
gpiobase+0x0050: 0x00000000 (RESERVED)
gpiobase+0x0054: 0x00000000 (RESERVED)
gpiobase+0x0058: 0x00000000 (RESERVED)
gpiobase+0x005c: 0x00000000 (RESERVED)
gpiobase+0x0060: 0x00000000 (GP_RST_SEL1)
gpiobase+0x0064: 0x00000000 (GP_RST_SEL2)
gpiobase+0x0068: 0x00000000 (GP_RST_SEL3)
gpiobase+0x006c: 0x00000000 (RESERVED)
gpiobase+0x0070: 0x00000000 (RESERVED)
gpiobase+0x0074: 0x00000000 (RESERVED)
gpiobase+0x0078: 0x00000000 (RESERVED)
gpiobase+0x007c: 0x00000000 (RESERVED)



============= RCBA ==============

RCBA = 0xfed1c000 (MEM)

0x0050: 0x812a0000
0x0054: 0x00000780
0x0084: 0x00000001
0x0404: 0x76543210
0x0800: 0x20100808
0x0804: 0x01000004
0x0808: 0x04210444
0x080c: 0x04210000
0x0810: 0x00660000
0x0818: 0x00170017
0x081c: 0x00000f00
0x0820: 0xf7401111
0x0834: 0x0001101c
0x0838: 0x04124044
0x0900: 0x00004000
0x0984: 0x00100000
0x0988: 0x00400010
0x098c: 0x00440000
0x0990: 0x00002000
0x0994: 0x00006000
0x09b0: 0x00000004
0x1000: 0x20100808
0x1004: 0x01000004
0x1008: 0x04210444
0x100c: 0x04210000
0x1010: 0x00007731
0x1020: 0x20100808
0x1024: 0x01000004
0x1028: 0x04210f11
0x102c: 0x04210000
0x1030: 0x00440010
0x1034: 0x0001101c
0x1038: 0x045a619a
0x103c: 0x045a0002
0x1040: 0x045a5555
0x1050: 0x00000003
0x1054: 0x00010000
0x1058: 0x0000003f
0x1100: 0x00006000
0x1104: 0x00000700
0x1194: 0x00002000
0x1d48: 0x00030000
0x1e80: 0x0000fffd
0x1e84: 0x000100f0
0x2014: 0x80000079
0x2020: 0x81000002
0x2030: 0x82000004
0x2040: 0x87000080
0x2088: 0x00109000
0x2094: 0x00002000
0x20ac: 0x40000000
0x21a4: 0x00023c42
0x21a8: 0x40420002
0x21b0: 0x00000002
0x2230: 0x00010000
0x2234: 0x0000000f
0x2238: 0x00000941
0x2240: 0x000a0299
0x2244: 0x001a02f1
0x2248: 0x00560385
0x224c: 0x00e20000
0x2250: 0x00f60006
0x2254: 0x00770695
0x2258: 0x00770303
0x2260: 0x00c10baa
0x2268: 0x00100040
0x2270: 0x00100000
0x2274: 0x00100040
0x2278: 0x001c0022
0x227c: 0x002c0062
0x2280: 0x001f0000
0x2284: 0x002f0000
0x2288: 0x004b0783
0x2298: 0x0008002e
0x22a0: 0x000a0000
0x22a4: 0x00100040
0x2304: 0xc07b8400
0x2308: 0x28000016
0x230c: 0x4abcb5bc
0x2310: 0x0009605b
0x2314: 0x0a880020
0x2318: 0x33b8fbe0
0x231c: 0x03ee0be1
0x2320: 0x00000002
0x2324: 0x00854c74
0x2328: 0x00421731
0x232c: 0x00000009
0x2330: 0xe5004e00
0x2334: 0x0005da01
0x2338: 0xf0000700
0x2340: 0x003a001b
0x2344: 0xff0c000c
0x2b00: 0x07ffffff
0x2b14: 0x1e0a0316
0x2b20: 0x00000001
0x2b24: 0x4000000b
0x2b28: 0x00000002
0x2b2c: 0x0000882d
0x2b50: 0x00040201
0x2b54: 0x07ffffff
0x2b58: 0x07ffffff
0x2b5c: 0x00000001
0x3020: 0xffffffff
0x3024: 0xffffffff
0x3028: 0xffffffff
0x302c: 0xffffffff
0x3030: 0xffffffff
0x3034: 0xffffffff
0x3038: 0xffffffff
0x303c: 0xffffffff
0x3040: 0xffffffff
0x3044: 0xffffffff
0x3048: 0xffffffff
0x304c: 0xffffffff
0x3050: 0xffffffff
0x3054: 0xffffffff
0x3058: 0xffffffff
0x305c: 0xffffffff
0x3060: 0xffffffff
0x3064: 0xffffffff
0x3068: 0xffffffff
0x306c: 0xffffffff
0x3070: 0xffffffff
0x3074: 0xffffffff
0x3078: 0xffffffff
0x307c: 0xffffffff
0x3080: 0xffffffff
0x3084: 0xffffffff
0x3088: 0xffffffff
0x308c: 0xffffffff
0x3090: 0xffffffff
0x3094: 0xffffffff
0x3098: 0xffffffff
0x309c: 0xffffffff
0x30a0: 0xffffffff
0x30a4: 0xffffffff
0x30a8: 0xffffffff
0x30ac: 0xffffffff
0x30b0: 0xffffffff
0x30b4: 0xffffffff
0x30b8: 0xffffffff
0x30bc: 0xffffffff
0x30c0: 0xffffffff
0x30c4: 0xffffffff
0x30c8: 0xffffffff
0x30cc: 0xffffffff
0x30d0: 0xffffffff
0x30d4: 0xffffffff
0x30d8: 0xffffffff
0x30dc: 0xffffffff
0x30e0: 0xffffffff
0x30e4: 0xffffffff
0x30e8: 0xffffffff
0x30ec: 0xffffffff
0x30f0: 0xffffffff
0x30f4: 0xffffffff
0x30f8: 0xffffffff
0x30fc: 0xffffffff
0x3100: 0x03143100
0x3108: 0x00000003
0x310c: 0x43214321
0x3110: 0x00000001
0x3114: 0x00000003
0x3118: 0x00000001
0x3124: 0x00002121
0x3128: 0x00000004
0x3140: 0x00000230
0x3144: 0x32103210
0x3148: 0x00003216
0x314c: 0x00003210
0x3150: 0x00007654
0x3154: 0x00003210
0x315c: 0x00001010
0x3160: 0x00003210
0x31fc: 0x03000000
0x3300: 0xffffffff
0x3304: 0xffffffff
0x3308: 0xffffffff
0x330c: 0xffffffff
0x3310: 0x05050100
0x3314: 0x000007bf
0x3318: 0x0dcf0020
0x331c: 0x80000000
0x3324: 0x04000000
0x3340: 0x020ddbff
0x3344: 0x00000001
0x3368: 0x00041000
0x3378: 0x3f8ddbff
0x337c: 0x000001e1
0x3388: 0x00001000
0x33a0: 0x00000800
0x33a4: 0x00000001
0x33ac: 0x00001000
0x33b0: 0x00001000
0x33c0: 0x00011900
0x33c8: 0x08000000
0x33d0: 0x06000802
0x33d4: 0xc80bc000
0x33f0: 0x30002de4
0x3400: 0x0000001c
0x3404: 0x00000080
0x3410: 0x00000c21
0x3414: 0x00000020
0x3418: 0x03f60001
0x341c: 0x80c10000
0x3424: 0x00060010
0x3428: 0x0000001f
0x3450: 0xfed04000
0x3458: 0xffffffff
0x345c: 0xffffffff
0x3460: 0xffffffff
0x3464: 0xffffffff
0x3468: 0xffffffff
0x346c: 0xffffffff
0x3470: 0xffffffff
0x3474: 0xffffffff
0x3478: 0xffffffff
0x347c: 0xffffffff
0x3480: 0xffffffff
0x3484: 0xffffffff
0x3488: 0xffffffff
0x348c: 0xffffffff
0x3490: 0xffffffff
0x3494: 0xffffffff
0x3498: 0xffffffff
0x349c: 0xffffffff
0x34a0: 0xffffffff
0x34a4: 0xffffffff
0x34a8: 0xffffffff
0x34ac: 0xffffffff
0x34b0: 0xffffffff
0x34b4: 0xffffffff
0x34b8: 0xffffffff
0x34bc: 0xffffffff
0x34c0: 0xffffffff
0x34c4: 0xffffffff
0x34c8: 0xffffffff
0x34cc: 0xffffffff
0x34d0: 0xffffffff
0x34d4: 0xffffffff
0x34d8: 0xffffffff
0x34dc: 0xffffffff
0x34e0: 0xffffffff
0x34e4: 0xffffffff
0x34e8: 0xffffffff
0x34ec: 0xffffffff
0x34f0: 0xffffffff
0x34f4: 0xffffffff
0x34f8: 0xffffffff
0x34fc: 0xffffffff
0x3500: 0xffffffff
0x3504: 0xffffffff
0x3508: 0xffffffff
0x350c: 0xffffffff
0x3510: 0xffffffff
0x3514: 0xffffffff
0x3518: 0xffffffff
0x351c: 0xffffffff
0x3520: 0xffffffff
0x3524: 0xffffffff
0x3528: 0xffffffff
0x352c: 0xffffffff
0x3530: 0xffffffff
0x3534: 0xffffffff
0x3538: 0xffffffff
0x353c: 0xffffffff
0x3540: 0xffffffff
0x3544: 0xffffffff
0x3548: 0xffffffff
0x354c: 0xffffffff
0x3550: 0xffffffff
0x3554: 0xffffffff
0x3558: 0xffffffff
0x355c: 0xffffffff
0x3560: 0xffffffff
0x3564: 0xffffffff
0x3568: 0xffffffff
0x356c: 0xffffffff
0x3570: 0xffffffff
0x3574: 0xffffffff
0x3578: 0xffffffff
0x357c: 0xffffffff
0x3580: 0xffffffff
0x3584: 0xffffffff
0x3588: 0xffffffff
0x358c: 0xffffffff
0x3590: 0xffffffff
0x3594: 0xffffffff
0x3598: 0xffffffff
0x359c: 0xffffffff
0x35a0: 0xffffffff
0x35a4: 0xffffffff
0x35a8: 0xffffffff
0x35ac: 0xffffffff
0x35b0: 0xffffffff
0x35b4: 0xffffffff
0x35b8: 0xffffffff
0x35bc: 0xffffffff
0x35c0: 0xffffffff
0x35c4: 0xffffffff
0x35c8: 0xffffffff
0x35cc: 0xffffffff
0x35d0: 0xffffffff
0x35d4: 0xffffffff
0x35d8: 0xffffffff
0x35dc: 0xffffffff
0x35e0: 0xffffffff
0x35e4: 0xffffffff
0x35e8: 0xffffffff
0x35ec: 0xffffffff
0x35f0: 0xffffffff
0x35f4: 0xffffffff
0x35f8: 0xffffffff
0x35fc: 0xffffffff
0x3600: 0xffffffff
0x3604: 0xffffffff
0x3608: 0xffffffff
0x360c: 0xffffffff
0x3610: 0xffffffff
0x3614: 0xffffffff
0x3618: 0xffffffff
0x361c: 0xffffffff
0x3620: 0xffffffff
0x3624: 0xffffffff
0x3628: 0xffffffff
0x362c: 0xffffffff
0x3630: 0xffffffff
0x3634: 0xffffffff
0x3638: 0xffffffff
0x363c: 0xffffffff
0x3640: 0xffffffff
0x3644: 0xffffffff
0x3648: 0xffffffff
0x364c: 0xffffffff
0x3650: 0xffffffff
0x3654: 0xffffffff
0x3658: 0xffffffff
0x365c: 0xffffffff
0x3660: 0xffffffff
0x3664: 0xffffffff
0x3668: 0xffffffff
0x366c: 0xffffffff
0x3670: 0xffffffff
0x3674: 0xffffffff
0x3678: 0xffffffff
0x367c: 0xffffffff
0x3680: 0xffffffff
0x3684: 0xffffffff
0x3688: 0xffffffff
0x368c: 0xffffffff
0x3690: 0xffffffff
0x3694: 0xffffffff
0x3698: 0xffffffff
0x369c: 0xffffffff
0x36a0: 0xffffffff
0x36a4: 0xffffffff
0x36a8: 0xffffffff
0x36ac: 0xffffffff
0x36b0: 0xffffffff
0x36b4: 0xffffffff
0x36b8: 0xffffffff
0x36bc: 0xffffffff
0x36c0: 0xffffffff
0x36c4: 0xffffffff
0x36c8: 0xffffffff
0x36cc: 0xffffffff
0x36d0: 0xffffffff
0x36d4: 0xffffffff
0x36d8: 0xffffffff
0x36dc: 0xffffffff
0x36e0: 0xffffffff
0x36e4: 0xffffffff
0x36e8: 0xffffffff
0x36ec: 0xffffffff
0x36f0: 0xffffffff
0x36f4: 0xffffffff
0x36f8: 0xffffffff
0x36fc: 0xffffffff
0x3700: 0xffffffff
0x3704: 0xffffffff
0x3708: 0xffffffff
0x370c: 0xffffffff
0x3710: 0xffffffff
0x3714: 0xffffffff
0x3718: 0xffffffff
0x371c: 0xffffffff
0x3720: 0xffffffff
0x3724: 0xffffffff
0x3728: 0xffffffff
0x372c: 0xffffffff
0x3730: 0xffffffff
0x3734: 0xffffffff
0x3738: 0xffffffff
0x373c: 0xffffffff
0x3740: 0xffffffff
0x3744: 0xffffffff
0x3748: 0xffffffff
0x374c: 0xffffffff
0x3750: 0xffffffff
0x3754: 0xffffffff
0x3758: 0xffffffff
0x375c: 0xffffffff
0x3760: 0xffffffff
0x3764: 0xffffffff
0x3768: 0xffffffff
0x376c: 0xffffffff
0x3770: 0xffffffff
0x3774: 0xffffffff
0x3778: 0xffffffff
0x377c: 0xffffffff
0x3780: 0xffffffff
0x3784: 0xffffffff
0x3788: 0xffffffff
0x378c: 0xffffffff
0x3790: 0xffffffff
0x3794: 0xffffffff
0x3798: 0xffffffff
0x379c: 0xffffffff
0x37a0: 0xffffffff
0x37a4: 0xffffffff
0x37a8: 0xffffffff
0x37ac: 0xffffffff
0x37b0: 0xffffffff
0x37b4: 0xffffffff
0x37b8: 0xffffffff
0x37bc: 0xffffffff
0x37c0: 0xffffffff
0x37c4: 0xffffffff
0x37c8: 0xffffffff
0x37cc: 0xffffffff
0x37d0: 0xffffffff
0x37d4: 0xffffffff
0x37d8: 0xffffffff
0x37dc: 0xffffffff
0x37e0: 0xffffffff
0x37e4: 0xffffffff
0x37e8: 0xffffffff
0x37ec: 0xffffffff
0x37f0: 0xffffffff
0x37f4: 0xffffffff
0x37f8: 0xffffffff
0x37fc: 0xffffffff
0x3800: 0x0fff0800
0x3804: 0x00006008
0x3850: 0x0000ffff
0x3858: 0x0fff0800
0x385c: 0x07ff0001
0x3860: 0x00007fff
0x3864: 0x00007fff
0x3868: 0x00007fff
0x386c: 0x00007fff
0x3890: 0xf80000c0
0x3894: 0x803b0006
0x3898: 0x05200302
0x389c: 0x5a009f9f
0x38b0: 0x0000403c
0x38b4: 0x01084a3e
0x38c0: 0x0000000f
0x38c4: 0x80802025
0x38d0: 0x50444653
0x38f0: 0x00000001
0x3a00: 0x03020100
0x3a04: 0x07060504
0x3a08: 0x0b0a0908
0x3a0c: 0x0f0e0d0c
0x3a20: 0x06060606
0x3a24: 0x00000606
0x3a28: 0x01010000
0x3a2c: 0x01010404
0x3a60: 0x00000010
0x3a6c: 0x00000001
0x3a80: 0x01040000
0x3a84: 0x05041001
0x3a88: 0x00000001
0x3b00: 0xffffffff
0x3b04: 0xffffffff
0x3b08: 0xffffffff
0x3b0c: 0xffffffff
0x3b10: 0xffffffff
0x3b14: 0xffffffff
0x3b18: 0xffffffff
0x3b1c: 0xffffffff
0x3b20: 0xffffffff
0x3b24: 0xffffffff
0x3b28: 0xffffffff
0x3b2c: 0xffffffff
0x3b30: 0xffffffff
0x3b34: 0xffffffff
0x3b38: 0xffffffff
0x3b3c: 0xffffffff
0x3b40: 0xffffffff
0x3b44: 0xffffffff
0x3b48: 0xffffffff
0x3b4c: 0xffffffff
0x3b50: 0xffffffff
0x3b54: 0xffffffff
0x3b58: 0xffffffff
0x3b5c: 0xffffffff
0x3b60: 0xffffffff
0x3b64: 0xffffffff
0x3b68: 0xffffffff
0x3b6c: 0xffffffff
0x3b70: 0xffffffff
0x3b74: 0xffffffff
0x3b78: 0xffffffff
0x3b7c: 0xffffffff
0x3b80: 0xffffffff
0x3b84: 0xffffffff
0x3b88: 0xffffffff
0x3b8c: 0xffffffff
0x3b90: 0xffffffff
0x3b94: 0xffffffff
0x3b98: 0xffffffff
0x3b9c: 0xffffffff
0x3ba0: 0xffffffff
0x3ba4: 0xffffffff
0x3ba8: 0xffffffff
0x3bac: 0xffffffff
0x3bb0: 0xffffffff
0x3bb4: 0xffffffff
0x3bb8: 0xffffffff
0x3bbc: 0xffffffff
0x3bc0: 0xffffffff
0x3bc4: 0xffffffff
0x3bc8: 0xffffffff
0x3bcc: 0xffffffff
0x3bd0: 0xffffffff
0x3bd4: 0xffffffff
0x3bd8: 0xffffffff
0x3bdc: 0xffffffff
0x3be0: 0xffffffff
0x3be4: 0xffffffff
0x3be8: 0xffffffff
0x3bec: 0xffffffff
0x3bf0: 0xffffffff
0x3bf4: 0xffffffff
0x3bf8: 0xffffffff
0x3bfc: 0xffffffff
0x3c00: 0xffffffff
0x3c04: 0xffffffff
0x3c08: 0xffffffff
0x3c0c: 0xffffffff
0x3c10: 0xffffffff
0x3c14: 0xffffffff
0x3c18: 0xffffffff
0x3c1c: 0xffffffff
0x3c20: 0xffffffff
0x3c24: 0xffffffff
0x3c28: 0xffffffff
0x3c2c: 0xffffffff
0x3c30: 0xffffffff
0x3c34: 0xffffffff
0x3c38: 0xffffffff
0x3c3c: 0xffffffff
0x3c40: 0xffffffff
0x3c44: 0xffffffff
0x3c48: 0xffffffff
0x3c4c: 0xffffffff
0x3c50: 0xffffffff
0x3c54: 0xffffffff
0x3c58: 0xffffffff
0x3c5c: 0xffffffff
0x3c60: 0xffffffff
0x3c64: 0xffffffff
0x3c68: 0xffffffff
0x3c6c: 0xffffffff
0x3c70: 0xffffffff
0x3c74: 0xffffffff
0x3c78: 0xffffffff
0x3c7c: 0xffffffff
0x3c80: 0xffffffff
0x3c84: 0xffffffff
0x3c88: 0xffffffff
0x3c8c: 0xffffffff
0x3c90: 0xffffffff
0x3c94: 0xffffffff
0x3c98: 0xffffffff
0x3c9c: 0xffffffff
0x3ca0: 0xffffffff
0x3ca4: 0xffffffff
0x3ca8: 0xffffffff
0x3cac: 0xffffffff
0x3cb0: 0xffffffff
0x3cb4: 0xffffffff
0x3cb8: 0xffffffff
0x3cbc: 0xffffffff
0x3cc0: 0xffffffff
0x3cc4: 0xffffffff
0x3cc8: 0xffffffff
0x3ccc: 0xffffffff
0x3cd0: 0xffffffff
0x3cd4: 0xffffffff
0x3cd8: 0xffffffff
0x3cdc: 0xffffffff
0x3ce0: 0xffffffff
0x3ce4: 0xffffffff
0x3ce8: 0xffffffff
0x3cec: 0xffffffff
0x3cf0: 0xffffffff
0x3cf4: 0xffffffff
0x3cf8: 0xffffffff
0x3cfc: 0xffffffff
0x3d00: 0xffffffff
0x3d04: 0xffffffff
0x3d08: 0xffffffff
0x3d0c: 0xffffffff
0x3d10: 0xffffffff
0x3d14: 0xffffffff
0x3d18: 0xffffffff
0x3d1c: 0xffffffff
0x3d20: 0xffffffff
0x3d24: 0xffffffff
0x3d28: 0xffffffff
0x3d2c: 0xffffffff
0x3d30: 0xffffffff
0x3d34: 0xffffffff
0x3d38: 0xffffffff
0x3d3c: 0xffffffff
0x3d40: 0xffffffff
0x3d44: 0xffffffff
0x3d48: 0xffffffff
0x3d4c: 0xffffffff
0x3d50: 0xffffffff
0x3d54: 0xffffffff
0x3d58: 0xffffffff
0x3d5c: 0xffffffff
0x3d60: 0xffffffff
0x3d64: 0xffffffff
0x3d68: 0xffffffff
0x3d6c: 0xffffffff
0x3d70: 0xffffffff
0x3d74: 0xffffffff
0x3d78: 0xffffffff
0x3d7c: 0xffffffff
0x3d80: 0xffffffff
0x3d84: 0xffffffff
0x3d88: 0xffffffff
0x3d8c: 0xffffffff
0x3d90: 0xffffffff
0x3d94: 0xffffffff
0x3d98: 0xffffffff
0x3d9c: 0xffffffff
0x3da0: 0xffffffff
0x3da4: 0xffffffff
0x3da8: 0xffffffff
0x3dac: 0xffffffff
0x3db0: 0xffffffff
0x3db4: 0xffffffff
0x3db8: 0xffffffff
0x3dbc: 0xffffffff
0x3dc0: 0xffffffff
0x3dc4: 0xffffffff
0x3dc8: 0xffffffff
0x3dcc: 0xffffffff
0x3dd0: 0xffffffff
0x3dd4: 0xffffffff
0x3dd8: 0xffffffff
0x3ddc: 0xffffffff
0x3de0: 0xffffffff
0x3de4: 0xffffffff
0x3de8: 0xffffffff
0x3dec: 0xffffffff
0x3df0: 0xffffffff
0x3df4: 0xffffffff
0x3df8: 0xffffffff
0x3dfc: 0xffffffff
0x3e00: 0xffffffff
0x3e04: 0xffffffff
0x3e08: 0xffffffff
0x3e0c: 0xffffffff
0x3e10: 0xffffffff
0x3e14: 0xffffffff
0x3e18: 0xffffffff
0x3e1c: 0xffffffff
0x3e20: 0xffffffff
0x3e24: 0xffffffff
0x3e28: 0xffffffff
0x3e2c: 0xffffffff
0x3e30: 0xffffffff
0x3e34: 0xffffffff
0x3e38: 0xffffffff
0x3e3c: 0xffffffff
0x3e40: 0xffffffff
0x3e44: 0xffffffff
0x3e48: 0xffffffff
0x3e4c: 0xffffffff
0x3e50: 0xffffffff
0x3e54: 0xffffffff
0x3e58: 0xffffffff
0x3e5c: 0xffffffff
0x3e60: 0xffffffff
0x3e64: 0xffffffff
0x3e68: 0xffffffff
0x3e6c: 0xffffffff
0x3e70: 0xffffffff
0x3e74: 0xffffffff
0x3e78: 0xffffffff
0x3e7c: 0xffffffff
0x3e80: 0xffffffff
0x3e84: 0xffffffff
0x3e88: 0xffffffff
0x3e8c: 0xffffffff
0x3e90: 0xffffffff
0x3e94: 0xffffffff
0x3e98: 0xffffffff
0x3e9c: 0xffffffff
0x3ea0: 0xffffffff
0x3ea4: 0xffffffff
0x3ea8: 0xffffffff
0x3eac: 0xffffffff
0x3eb0: 0xffffffff
0x3eb4: 0xffffffff
0x3eb8: 0xffffffff
0x3ebc: 0xffffffff
0x3ec0: 0xffffffff
0x3ec4: 0xffffffff
0x3ec8: 0xffffffff
0x3ecc: 0xffffffff
0x3ed0: 0xffffffff
0x3ed4: 0xffffffff
0x3ed8: 0xffffffff
0x3edc: 0xffffffff
0x3ee0: 0xffffffff
0x3ee4: 0xffffffff
0x3ee8: 0xffffffff
0x3eec: 0xffffffff
0x3ef0: 0xffffffff
0x3ef4: 0xffffffff
0x3ef8: 0xffffffff
0x3efc: 0xffffffff
0x3f00: 0x0000010b

============= IOBP ==============

0xea002488: 0x5580983a (SECRT88P0)
0xea00248c: 0x0c802040 (SECRT8CP0)
0xea002490: 0x2b403e67 (SECRT90P0)
0xea002498: 0x1f203b41 (SECRT98P0)
0xea00251c: 0x00001810 (SECRR1CP0)
0xea002550: 0x053f3f3f (SECRR50P0)
0xea002554: 0x00050000 (SECRR54P0)
0xea002558: 0xa0809000 (SECRR58P0)
0xea002688: 0x5580983a (SECRT88P1)
0xea00268c: 0x0c802040 (SECRT8CP1)
0xea002690: 0x2b403e67 (SECRT90P1)
0xea002698: 0x1f203b41 (SECRT98P1)
0xea00271c: 0x00001810 (SECRR1CP1)
0xea002750: 0x053f3f3f (SECRR50P1)
0xea002754: 0x00050000 (SECRR54P1)
0xea002758: 0xa0809000 (SECRR58P1)
0xea000888: 0x5580983a (SECRT88P2)
0xea00088c: 0x0c802040 (SECRT8CP2)
0xea000890: 0x2b403e67 (SECRT90P2)
0xea000898: 0x1f203b41 (SECRT98P2)
0xea00091c: 0x00001810 (SECRR1CP2)
0xea000950: 0x053f3f3f (SECRR50P2)
0xea000954: 0x00050000 (SECRR54P2)
0xea000958: 0xa0809000 (SECRR58P2)
0xea000a88: 0x5580983a (SECRT88P3)
0xea000a8c: 0x0c802040 (SECRT8CP3)
0xea000a90: 0x2b403e67 (SECRT90P3)
0xea000a98: 0x1f203b41 (SECRT98P3)
0xea000b1c: 0x00001810 (SECRR1CP3)
0xea000b50: 0x053f3f3f (SECRR50P3)
0xea000b54: 0x00050000 (SECRR54P3)
0xea000b58: 0xa0809000 (SECRR58P3)
0xea002088: 0x5580983a (SECRT88P4)
0xea00208c: 0x0c802046 (SECRT8CP4)
0xea002090: 0x2b3e3e67 (SECRT90P4)
0xea002098: 0x1f203b41 (SECRT98P4)
0xea00211c: 0x00001810 (SECRR1CP4)
0xea002150: 0x053f3f3f (SECRR50P4)
0xea002154: 0x00050000 (SECRR54P4)
0xea002158: 0xa0809000 (SECRR58P4)
0xea002288: 0x5580983a (SECRT88P5)
0xea00228c: 0x0c802046 (SECRT8CP5)
0xea002290: 0x2b3e3e67 (SECRT90P5)
0xea002298: 0x1f203b41 (SECRT98P5)
0xea00231c: 0x00001810 (SECRR1CP5)
0xea002350: 0x053f3f3f (SECRR50P5)
0xea002354: 0x00050000 (SECRR54P5)
0xea002358: 0xa0809000 (SECRR58P5)
0xea008100: 0x7880fffc (SECRF00)
0xea008104: 0x69777888 (SECRF04)
0xe5004100: 0x00059c01 (U2ECRP01)
0xe5004200: 0x0005a401 (U2ECRP02)
0xe5004300: 0x00059301 (U2ECRP03)
0xe5004400: 0x00059301 (U2ECRP04)
0xe5004500: 0x00059301 (U2ECRP05)
0xe5004600: 0x00059301 (U2ECRP06)
0xe5004700: 0x00059301 (U2ECRP07)
0xe5004800: 0x00059301 (U2ECRP08)
0xe5004900: 0x0005a401 (U2ECRP09)
0xe5004a00: 0x0005a401 (U2ECRP10)
0xe5004b00: 0x0005a401 (U2ECRP11)
0xe5004c00: 0x0005a401 (U2ECRP12)
0xe5004d00: 0x00059301 (U2ECRP13)
0xe5004e00: 0x00059301 (U2ECRP14)
0xe900175c: 0x80889090 ()
0xe9001760: 0x00000000 ()
0xe9001768: 0xba004a2a ()
0xe9001770: 0x00000020 ()
0xe90017cc: 0x38255707 ()
0xe900155c: 0x80889090 ()
0xe9001560: 0x00000000 ()
0xe9001568: 0xba004a2a ()
0xe9001570: 0x00000020 ()
0xe90015cc: 0x38255707 ()
0xe9002f5c: 0x80889090 ()
0xe9002f60: 0x00000000 ()
0xe9002f68: 0xbb004822 ()
0xe9002f70: 0x00000030 ()
0xe9002fcc: 0x38254304 ()
0xe9002d5c: 0x80889090 ()
0xe9002d60: 0x00000000 ()
0xe9002d68: 0xbb004822 ()
0xe9002d70: 0x00000030 ()
0xe9002dcc: 0x38254304 ()
0xe900335c: 0x80889090 ()
0xe9003360: 0x00000000 ()
0xe9003368: 0xba004a2a ()
0xe9003370: 0x00000020 ()
0xe90033cc: 0x38255707 ()
0xe900315c: 0x82839192 ()
0xe9003160: 0x00000000 ()
0xe9003168: 0xba004a2a ()
0xe9003170: 0x00000020 ()
0xe90031cc: 0x38255707 ()



========== ACPI/PMC =========


========== ABASE/PMBASE =========

PMBASE = 0x0400 (IO)

pmbase+0x0000: 0x0001     (PM1_STS)
pmbase+0x0002: 0x0100     (PM1_EN)
pmbase+0x0004: 0x00000001 (PM1_CNT)
pmbase+0x0008: 0x00f8e44a (PM1_TMR)
pmbase+0x000c: 0x00000000 (RESERVED)
pmbase+0x0010: 0x00000000 (RESERVED)
pmbase+0x0014: 0x00000000 (RESERVED)
pmbase+0x0018: 0x00000000 (RESERVED)
pmbase+0x001c: 0x00000000 (RESERVED)
pmbase+0x0020: 0x66fd0000 (GPE0_STS)
               0x94000008
pmbase+0x0028: 0x00000202 (GPE0_EN)
               0x00000000
pmbase+0x0030: 0x8802202b (SMI_EN)
pmbase+0x0034: 0x00004100 (SMI_STS)
pmbase+0x0038: 0x0000     (ALT_GP_SMI_EN)
pmbase+0x003a: 0x6efd     (ALT_GP_SMI_STS)
pmbase+0x003c: 0x00       (UPRWC)
pmbase+0x003d: 0x00       (RESERVED)
pmbase+0x003e: 0x0000     (RESERVED)
pmbase+0x0040: 0x0000     (RESERVED)
pmbase+0x0042: 0x00       (GPE_CNTL)
pmbase+0x0043: 0x00       (RESERVED)
pmbase+0x0044: 0x1320     (DEVACT_STS)
pmbase+0x0046: 0x0000     (RESERVED)
pmbase+0x0048: 0x00000000 (RESERVED)
pmbase+0x004c: 0x00000000 (RESERVED)
pmbase+0x0050: 0x00       (PM2_CNT)
pmbase+0x0051: 0x00       (RESERVED)
pmbase+0x0052: 0x0000     (RESERVED)
pmbase+0x0054: 0x00002000 (RESERVED)
pmbase+0x0058: 0x00000000 (RESERVED)
pmbase+0x005c: 0x00de0000 (RESERVED)
pmbase+0x0060: 0x0004     (TCO_RLD)
pmbase+0x0062: 0x00       (TCO_DAT_IN)
pmbase+0x0063: 0x00       (TCO_DAT_OUT)
pmbase+0x0064: 0x0000     (TCO1_STS)
pmbase+0x0066: 0x0000     (TCO2_STS)
pmbase+0x0068: 0x1800     (TCO1_CNT)
pmbase+0x006a: 0x0008     (TCO2_CNT)
pmbase+0x006c: 0x0000     (TCO_MESSAGE)
pmbase+0x006e: 0x00       (TCO_WDCNT)
pmbase+0x006f: 0x00       (RESERVED)
pmbase+0x0070: 0x03       (SW_IRQ_GEN)
pmbase+0x0071: 0x00       (RESERVED)
pmbase+0x0072: 0x0004     (TCO_TMR)
pmbase+0x0074: 0x00000000 (RESERVED)
pmbase+0x0078: 0x00000000 (RESERVED)
pmbase+0x007c: 0x00000000 (RESERVED)



========== LPC/eSPI =========

Error: Dumping LPC/eSPI on this southbridgError: Dumping AMBs on this MCH is not (yet) supported.
e is not (yet) supported.



============= MCHBAR ============

Error: Dumping MCHBAR on this northbridge is not (yet) supported.



============= EPBAR =============

Error: Dumping EPBAR on this northbridge is not (yet) supported.



============= DMIBAR ============

Error: Dumping DMIBAR on this northbridge is not (yet) supported.


========= PCIEXBAR ========

Error: Dumping PCIEXBAR on this northbridge is not (yet) supported.


Error: Dumping MSRs on this CPU (0x0306f0) is not (yet) supported.



============= AMBs ============


============= SPI / BIOS CNTL =============

BIOS_CNTL = 0x0028 (IO)

0x0000 = BIOSWE - write enable
0x0000 = BLE - lock enable
0x0002 = SPI Read configuration
0x0000 = TopSwapStatus
0x0001 = SMM BIOS Write Protect Disable
0x0000 = reserved

============= SPI Bar ==============

0x0fff0800 = BFPR - BIOS Flash primary region
0x00006008 = HSFSTS - Hardware Sequencing Flash Status
0x00000000 = HSFCTL - Hardware Sequencing Flash Control
0x00000000 = FADDR - Flash Address
0x00000000 = Reserved
0x00000000 = FDATA0
0x0000ffff = FRACC - Flash Region Access Permissions
0x00000000 = Flash Region 0
0x0fff0800 = Flash Region 1
0x07ff0001 = Flash Region 2
0x00007fff = Flash Region 3
0x00007fff = Flash Region 4
0x00000000 = FPR0 Flash Protected Range 0
0x00000000 = FPR0 Flash Protected Range 1
0x00000000 = FPR0 Flash Protected Range 2
0x00000000 = FPR0 Flash Protected Range 3
0x00000000 = FPR0 Flash Protected Range 4
0x000000c0 = SSFSTS - Software Sequencing Flash Status
0x00000006 = PREOP - Prefix opcode Configuration
0x0000803b = OPTYPE - Opcode Type Configuration
0x5a009f9f05200302 = OPMENU - Opcode Menu Configuration
0x00000000 = BBAR - BIOS Base Address Configuration
0x0000403c = FDOC - Flash Descriptor Observability Control
0x00000000 = Reserved
0x0000000f = AFC - Additional Flash Control
0x80802025 = LVSCC - Host Lower Vendor Specific Component Capabilities
0x00000000 = UVSCC - Host Upper Vendor Specific Component Capabilities
0x50444653 = FPB - Flash Partition Boundary
No IGD found

============= AHCI Registers ==============


============= AHCI Configuration Registers ==============


============= SATA Initialization Registers ==============


============= ABAR ==============

ABAR = 0xfbf00000 (MEM)

Generic Host Control Registers:
0x000: 0xc730ff45 (CAP)
0x004: 0x80000002 (GHC)
0x008: 0x00000000 (IS)
0x00c: 0x00000003 (PI)
0x010: 0x00010300 (VS)
0x014: 0x00000000 (CCC_CTL)
0x018: 0x00000000 (CCC_PORTS)
0x01c: 0x01600002 (EM_LOC)
0x020: 0x07010000 (EM_CTL)
0x024: 0x00000004 (CAP2)
0x028: 0x00000000 (BOHC)
0x0a0: 0x00000048 (Reserved)
0x0a4: 0x018002fe (Reserved)
0x0c0: 0x00318c02 (Reserved)
0x0c8: 0x000000c0 (Reserved)

Port 0 Control Registers:
0x100: 0x0b680000 (PxCLB)
0x104: 0x00000001 (PxCLBU)
0x108: 0x0b680400 (PxFB)
0x10c: 0x00000001 (PxFBU)
0x110: 0x00000000 (PxIS)
0x114: 0x7840007f (PxIE)
0x118: 0x0000d317 (PxCMD)
0x11c: 0x00000000 (Reserved)
0x120: 0x00000050 (PxTFD)
0x124: 0x00000101 (PxSIG)
0x128: 0x00000133 (PxSSTS)
0x12c: 0x00000700 (PxSCTL)
0x130: 0x00000000 (PxSERR)
0x134: 0x00000000 (PxSACT)
0x138: 0x00000000 (PxCI)
0x13c: 0x00000000 (PxSNTF)
0x140: 0x00000000 (PxFBS)
0x144: 0x00000000 (PxDEVSLP)
0x148: 0x00000000 (Reserved)

Port 1 Control Registers:
0x180: 0x0b6a0000 (PxCLB)
0x184: 0x00000001 (PxCLBU)
0x188: 0x0b6a0400 (PxFB)
0x18c: 0x00000001 (PxFBU)
0x190: 0x00000000 (PxIS)
0x194: 0x7840007f (PxIE)
0x198: 0x0000ce17 (PxCMD)
0x19c: 0x00000000 (Reserved)
0x1a0: 0x00000050 (PxTFD)
0x1a4: 0x00000101 (PxSIG)
0x1a8: 0x00000133 (PxSSTS)
0x1ac: 0x00000700 (PxSCTL)
0x1b0: 0x00000000 (PxSERR)
0x1b4: 0x00000000 (PxSACT)
0x1b8: 0x00000000 (PxCI)
0x1bc: 0x00000000 (PxSNTF)
0x1c0: 0x00000000 (PxFBS)
0x1c4: 0x00000000 (PxDEVSLP)
0x1c8: 0x00000000 (Reserved)

Other registers:

============= Dumping INTEL SGX status =============
Number of CPUs = 20
------------- CPU 0 ----------------
SGX supported             : NO
SGX enabled               : NO
Feature Control locked    : YES
------------- CPU 1 ----------------
SGX supported             : NO
SGX enabled               : NO
Feature Control locked    : YES
------------- CPU 2 ----------------
SGX supported             : NO
SGX enabled               : NO
Feature Control locked    : YES
------------- CPU 3 ----------------
SGX supported             : NO
SGX enabled               : NO
Feature Control locked    : YES
------------- CPU 4 ----------------
SGX supported             : NO
SGX enabled               : NO
Feature Control locked    : YES
------------- CPU 5 ----------------
SGX supported             : NO
SGX enabled               : NO
Feature Control locked    : YES
------------- CPU 6 ----------------
SGX supported             : NO
SGX enabled               : NO
Feature Control locked    : YES
------------- CPU 7 ----------------
SGX supported             : NO
SGX enabled               : NO
Feature Control locked    : YES
------------- CPU 8 ----------------
SGX supported             : NO
SGX enabled               : NO
Feature Control locked    : YES
------------- CPU 9 ----------------
SGX supported             : NO
SGX enabled               : NO
Feature Control locked    : YES
------------- CPU 10 ----------------
SGX supported             : NO
SGX enabled               : NO
Feature Control locked    : YES
------------- CPU 11 ----------------
SGX supported             : NO
SGX enabled               : NO
Feature Control locked    : YES
------------- CPU 12 ----------------
SGX supported             : NO
SGX enabled               : NO
Feature Control locked    : YES
------------- CPU 13 ----------------
SGX supported             : NO
SGX enabled               : NO
Feature Control locked    : YES
------------- CPU 14 ----------------
SGX supported             : NO
SGX enabled               : NO
Feature Control locked    : YES
------------- CPU 15 ----------------
SGX supported             : NO
SGX enabled               : NO
Feature Control locked    : YES
------------- CPU 16 ----------------
SGX supported             : NO
SGX enabled               : NO
Feature Control locked    : YES
------------- CPU 17 ----------------
SGX supported             : NO
SGX enabled               : NO
Feature Control locked    : YES
------------- CPU 18 ----------------
SGX supported             : NO
SGX enabled               : NO
Feature Control locked    : YES
------------- CPU 19 ----------------
SGX supported             : NO
SGX enabled               : NO
Feature Control locked    : YES
====================================================

============= Dumping INTEL TME status =============
TME supported : NO
====================================================

============= Dumping INTEL Key Locker status =============
Key Locker supported : NO
===========================================================
